14:26:21.467380 IP dhcp-10-250-101-2.harvard.edu.55168 > dhcp-10-250-101-2.harvard.edu.6000: Flags [S], seq 2679450215, win 65535, options [mss 16344,nop,wscale 6,nop,nop,TS val 828074674 ecr 0,sackOK,eol], length 0
14:26:21.467513 IP dhcp-10-250-101-2.harvard.edu.6000 > dhcp-10-250-101-2.harvard.edu.55168: Flags [S.], seq 1170212567, ack 2679450216, win 65535, options [mss 16344,nop,wscale 6,nop,nop,TS val 828074674 ecr 828074674,sackOK,eol], length 0
14:26:21.467519 IP dhcp-10-250-101-2.harvard.edu.55168 > dhcp-10-250-101-2.harvard.edu.6000: Flags [.], ack 1, win 6379, options [nop,nop,TS val 828074674 ecr 828074674], length 0
14:26:21.467525 IP dhcp-10-250-101-2.harvard.edu.6000 > dhcp-10-250-101-2.harvard.edu.55168: Flags [.], ack 1, win 6379, options [nop,nop,TS val 828074674 ecr 828074674], length 0
14:26:21.479677 IP dhcp-10-250-101-2.harvard.edu.55168 > dhcp-10-250-101-2.harvard.edu.6000: Flags [P.], seq 1:71, ack 1, win 6379, options [nop,nop,TS val 828074685 ecr 828074674], length 70
14:26:21.479710 IP dhcp-10-250-101-2.harvard.edu.6000 > dhcp-10-250-101-2.harvard.edu.55168: Flags [.], ack 71, win 6378, options [nop,nop,TS val 828074685 ecr 828074685], length 0
14:26:21.486059 IP dhcp-10-250-101-2.harvard.edu.6000 > dhcp-10-250-101-2.harvard.edu.55168: Flags [P.], seq 1:41, ack 71, win 6378, options [nop,nop,TS val 828074691 ecr 828074685], length 40
14:26:21.486112 IP dhcp-10-250-101-2.harvard.edu.55168 > dhcp-10-250-101-2.harvard.edu.6000: Flags [.], ack 41, win 6379, options [nop,nop,TS val 828074691 ecr 828074691], length 0
14:26:21.490106 IP dhcp-10-250-101-2.harvard.edu.6000 > dhcp-10-250-101-2.harvard.edu.55168: Flags [P.], seq 41:50, ack 71, win 6378, options [nop,nop,TS val 828074694 ecr 828074691], length 9
14:26:21.490160 IP dhcp-10-250-101-2.harvard.edu.55168 > dhcp-10-250-101-2.harvard.edu.6000: Flags [.], ack 50, win 6378, options [nop,nop,TS val 828074694 ecr 828074694], length 0
14:26:21.501523 IP dhcp-10-250-101-2.harvard.edu.55168 > dhcp-10-250-101-2.harvard.edu.6000: Flags [P.], seq 71:80, ack 50, win 6378, options [nop,nop,TS val 828074705 ecr 828074694], length 9
14:26:21.501577 IP dhcp-10-250-101-2.harvard.edu.6000 > dhcp-10-250-101-2.harvard.edu.55168: Flags [.], ack 80, win 6378, options [nop,nop,TS val 828074705 ecr 828074705], length 0
14:26:21.514415 IP dhcp-10-250-101-2.harvard.edu.55168 > dhcp-10-250-101-2.harvard.edu.6000: Flags [P.], seq 80:14619, ack 50, win 6378, options [nop,nop,TS val 828074717 ecr 828074705], length 14539
14:26:21.514471 IP dhcp-10-250-101-2.harvard.edu.6000 > dhcp-10-250-101-2.harvard.edu.55168: Flags [.], ack 14619, win 6151, options [nop,nop,TS val 828074717 ecr 828074717], length 0
14:26:21.525572 IP dhcp-10-250-101-2.harvard.edu.6000 > dhcp-10-250-101-2.harvard.edu.55168: Flags [P.], seq 50:67, ack 14619, win 6151, options [nop,nop,TS val 828074726 ecr 828074717], length 17
14:26:21.525602 IP dhcp-10-250-101-2.harvard.edu.55168 > dhcp-10-250-101-2.harvard.edu.6000: Flags [.], ack 67, win 6378, options [nop,nop,TS val 828074726 ecr 828074726], length 0
14:26:21.525939 IP dhcp-10-250-101-2.harvard.edu.55168 > dhcp-10-250-101-2.harvard.edu.6000: Flags [P.], seq 14619:14636, ack 67, win 6378, options [nop,nop,TS val 828074727 ecr 828074726], length 17
14:26:21.525955 IP dhcp-10-250-101-2.harvard.edu.6000 > dhcp-10-250-101-2.harvard.edu.55168: Flags [.], ack 14636, win 6151, options [nop,nop,TS val 828074727 ecr 828074727], length 0
14:26:21.623338 IP dhcp-10-250-101-2.harvard.edu.6000 > dhcp-10-250-101-2.harvard.edu.55168: Flags [P.], seq 67:160, ack 14636, win 6151, options [nop,nop,TS val 828074822 ecr 828074727], length 93
14:26:21.623395 IP dhcp-10-250-101-2.harvard.edu.55168 > dhcp-10-250-101-2.harvard.edu.6000: Flags [.], ack 160, win 6377, options [nop,nop,TS val 828074822 ecr 828074822], length 0
14:26:21.624873 IP dhcp-10-250-101-2.harvard.edu.6000 > dhcp-10-250-101-2.harvard.edu.55168: Flags [P.], seq 160:184, ack 14636, win 6151, options [nop,nop,TS val 828074823 ecr 828074822], length 24
14:26:21.624930 IP dhcp-10-250-101-2.harvard.edu.55168 > dhcp-10-250-101-2.harvard.edu.6000: Flags [.], ack 184, win 6376, options [nop,nop,TS val 828074823 ecr 828074823], length 0
14:26:21.626204 IP dhcp-10-250-101-2.harvard.edu.55168 > dhcp-10-250-101-2.harvard.edu.6000: Flags [P.], seq 14636:14653, ack 184, win 6376, options [nop,nop,TS val 828074824 ecr 828074823], length 17
14:26:21.626252 IP dhcp-10-250-101-2.harvard.edu.6000 > dhcp-10-250-101-2.harvard.edu.55168: Flags [.], ack 14653, win 6150, options [nop,nop,TS val 828074824 ecr 828074824], length 0
14:26:21.626516 IP dhcp-10-250-101-2.harvard.edu.6000 > dhcp-10-250-101-2.harvard.edu.55168: Flags [P.], seq 184:201, ack 14653, win 6150, options [nop,nop,TS val 828074824 ecr 828074824], length 17
14:26:21.626565 IP dhcp-10-250-101-2.harvard.edu.55168 > dhcp-10-250-101-2.harvard.edu.6000: Flags [.], ack 201, win 6376, options [nop,nop,TS val 828074824 ecr 828074824], length 0
14:26:21.636787 IP dhcp-10-250-101-2.harvard.edu.55169 > dhcp-10-250-101-2.harvard.edu.6001: Flags [S], seq 2243495228, win 65535, options [mss 16344,nop,wscale 6,nop,nop,TS val 828074832 ecr 0,sackOK,eol], length 0
14:26:21.636906 IP dhcp-10-250-101-2.harvard.edu.6001 > dhcp-10-250-101-2.harvard.edu.55169: Flags [S.], seq 3379910933, ack 2243495229, win 65535, options [mss 16344,nop,wscale 6,nop,nop,TS val 828074832 ecr 828074832,sackOK,eol], length 0
14:26:21.636916 IP dhcp-10-250-101-2.harvard.edu.55169 > dhcp-10-250-101-2.harvard.edu.6001: Flags [.], ack 1, win 6379, options [nop,nop,TS val 828074833 ecr 828074832], length 0
14:26:21.636923 IP dhcp-10-250-101-2.harvard.edu.6001 > dhcp-10-250-101-2.harvard.edu.55169: Flags [.], ack 1, win 6379, options [nop,nop,TS val 828074833 ecr 828074833], length 0
14:26:21.638877 IP dhcp-10-250-101-2.harvard.edu.55169 > dhcp-10-250-101-2.harvard.edu.6001: Flags [P.], seq 1:71, ack 1, win 6379, options [nop,nop,TS val 828074834 ecr 828074833], length 70
14:26:21.638918 IP dhcp-10-250-101-2.harvard.edu.6001 > dhcp-10-250-101-2.harvard.edu.55169: Flags [.], ack 71, win 6378, options [nop,nop,TS val 828074834 ecr 828074834], length 0
14:26:21.640740 IP dhcp-10-250-101-2.harvard.edu.6001 > dhcp-10-250-101-2.harvard.edu.55169: Flags [P.], seq 1:41, ack 71, win 6378, options [nop,nop,TS val 828074835 ecr 828074834], length 40
14:26:21.640791 IP dhcp-10-250-101-2.harvard.edu.55169 > dhcp-10-250-101-2.harvard.edu.6001: Flags [.], ack 41, win 6379, options [nop,nop,TS val 828074835 ecr 828074835], length 0
14:26:21.641480 IP dhcp-10-250-101-2.harvard.edu.6001 > dhcp-10-250-101-2.harvard.edu.55169: Flags [P.], seq 41:50, ack 71, win 6378, options [nop,nop,TS val 828074835 ecr 828074835], length 9
14:26:21.641499 IP dhcp-10-250-101-2.harvard.edu.55169 > dhcp-10-250-101-2.harvard.edu.6001: Flags [.], ack 50, win 6378, options [nop,nop,TS val 828074835 ecr 828074835], length 0
14:26:21.641582 IP dhcp-10-250-101-2.harvard.edu.55169 > dhcp-10-250-101-2.harvard.edu.6001: Flags [P.], seq 71:80, ack 50, win 6378, options [nop,nop,TS val 828074835 ecr 828074835], length 9
14:26:21.641627 IP dhcp-10-250-101-2.harvard.edu.6001 > dhcp-10-250-101-2.harvard.edu.55169: Flags [.], ack 80, win 6378, options [nop,nop,TS val 828074835 ecr 828074835], length 0
14:26:21.643323 IP dhcp-10-250-101-2.harvard.edu.55169 > dhcp-10-250-101-2.harvard.edu.6001: Flags [P.], seq 80:8331, ack 50, win 6378, options [nop,nop,TS val 828074837 ecr 828074835], length 8251
14:26:21.643349 IP dhcp-10-250-101-2.harvard.edu.6001 > dhcp-10-250-101-2.harvard.edu.55169: Flags [.], ack 8331, win 6249, options [nop,nop,TS val 828074837 ecr 828074837], length 0
14:26:21.644346 IP dhcp-10-250-101-2.harvard.edu.6001 > dhcp-10-250-101-2.harvard.edu.55169: Flags [P.], seq 50:67, ack 8331, win 6249, options [nop,nop,TS val 828074838 ecr 828074837], length 17
14:26:21.644367 IP dhcp-10-250-101-2.harvard.edu.55169 > dhcp-10-250-101-2.harvard.edu.6001: Flags [.], ack 67, win 6378, options [nop,nop,TS val 828074838 ecr 828074838], length 0
14:26:21.644596 IP dhcp-10-250-101-2.harvard.edu.55169 > dhcp-10-250-101-2.harvard.edu.6001: Flags [P.], seq 8331:8348, ack 67, win 6378, options [nop,nop,TS val 828074838 ecr 828074838], length 17
14:26:21.644640 IP dhcp-10-250-101-2.harvard.edu.6001 > dhcp-10-250-101-2.harvard.edu.55169: Flags [.], ack 8348, win 6249, options [nop,nop,TS val 828074838 ecr 828074838], length 0
14:26:21.659990 IP dhcp-10-250-101-2.harvard.edu.6001 > dhcp-10-250-101-2.harvard.edu.55169: Flags [P.], seq 67:184, ack 8348, win 6249, options [nop,nop,TS val 828074853 ecr 828074838], length 117
14:26:21.660047 IP dhcp-10-250-101-2.harvard.edu.55169 > dhcp-10-250-101-2.harvard.edu.6001: Flags [.], ack 184, win 6376, options [nop,nop,TS val 828074853 ecr 828074853], length 0
14:26:21.661361 IP dhcp-10-250-101-2.harvard.edu.55169 > dhcp-10-250-101-2.harvard.edu.6001: Flags [P.], seq 8348:8365, ack 184, win 6376, options [nop,nop,TS val 828074854 ecr 828074853], length 17
14:26:21.661414 IP dhcp-10-250-101-2.harvard.edu.6001 > dhcp-10-250-101-2.harvard.edu.55169: Flags [.], ack 8365, win 6249, options [nop,nop,TS val 828074854 ecr 828074854], length 0
14:26:21.661622 IP dhcp-10-250-101-2.harvard.edu.6001 > dhcp-10-250-101-2.harvard.edu.55169: Flags [P.], seq 184:201, ack 8365, win 6249, options [nop,nop,TS val 828074854 ecr 828074854], length 17
14:26:21.661676 IP dhcp-10-250-101-2.harvard.edu.55169 > dhcp-10-250-101-2.harvard.edu.6001: Flags [.], ack 201, win 6376, options [nop,nop,TS val 828074854 ecr 828074854], length 0
14:26:21.666224 IP dhcp-10-250-101-2.harvard.edu.55170 > dhcp-10-250-101-2.harvard.edu.6002: Flags [S], seq 1441668270, win 65535, options [mss 16344,nop,wscale 6,nop,nop,TS val 828074857 ecr 0,sackOK,eol], length 0
14:26:21.666344 IP dhcp-10-250-101-2.harvard.edu.6002 > dhcp-10-250-101-2.harvard.edu.55170: Flags [S.], seq 61114027, ack 1441668271, win 65535, options [mss 16344,nop,wscale 6,nop,nop,TS val 828074857 ecr 828074857,sackOK,eol], length 0
14:26:21.666354 IP dhcp-10-250-101-2.harvard.edu.55170 > dhcp-10-250-101-2.harvard.edu.6002: Flags [.], ack 1, win 6379, options [nop,nop,TS val 828074858 ecr 828074857], length 0
14:26:21.666360 IP dhcp-10-250-101-2.harvard.edu.6002 > dhcp-10-250-101-2.harvard.edu.55170: Flags [.], ack 1, win 6379, options [nop,nop,TS val 828074858 ecr 828074858], length 0
14:26:21.668166 IP dhcp-10-250-101-2.harvard.edu.55170 > dhcp-10-250-101-2.harvard.edu.6002: Flags [P.], seq 1:71, ack 1, win 6379, options [nop,nop,TS val 828074859 ecr 828074858], length 70
14:26:21.668205 IP dhcp-10-250-101-2.harvard.edu.6002 > dhcp-10-250-101-2.harvard.edu.55170: Flags [.], ack 71, win 6378, options [nop,nop,TS val 828074859 ecr 828074859], length 0
14:26:21.669951 IP dhcp-10-250-101-2.harvard.edu.6002 > dhcp-10-250-101-2.harvard.edu.55170: Flags [P.], seq 1:41, ack 71, win 6378, options [nop,nop,TS val 828074860 ecr 828074859], length 40
14:26:21.670000 IP dhcp-10-250-101-2.harvard.edu.55170 > dhcp-10-250-101-2.harvard.edu.6002: Flags [.], ack 41, win 6379, options [nop,nop,TS val 828074860 ecr 828074860], length 0
14:26:21.670614 IP dhcp-10-250-101-2.harvard.edu.6002 > dhcp-10-250-101-2.harvard.edu.55170: Flags [P.], seq 41:50, ack 71, win 6378, options [nop,nop,TS val 828074860 ecr 828074860], length 9
14:26:21.670631 IP dhcp-10-250-101-2.harvard.edu.55170 > dhcp-10-250-101-2.harvard.edu.6002: Flags [.], ack 50, win 6378, options [nop,nop,TS val 828074860 ecr 828074860], length 0
14:26:21.670693 IP dhcp-10-250-101-2.harvard.edu.55170 > dhcp-10-250-101-2.harvard.edu.6002: Flags [P.], seq 71:80, ack 50, win 6378, options [nop,nop,TS val 828074860 ecr 828074860], length 9
14:26:21.670744 IP dhcp-10-250-101-2.harvard.edu.6002 > dhcp-10-250-101-2.harvard.edu.55170: Flags [.], ack 80, win 6378, options [nop,nop,TS val 828074860 ecr 828074860], length 0
14:26:21.671306 IP dhcp-10-250-101-2.harvard.edu.55170 > dhcp-10-250-101-2.harvard.edu.6002: Flags [P.], seq 80:3006, ack 50, win 6378, options [nop,nop,TS val 828074861 ecr 828074860], length 2926
14:26:21.671350 IP dhcp-10-250-101-2.harvard.edu.6002 > dhcp-10-250-101-2.harvard.edu.55170: Flags [.], ack 3006, win 6332, options [nop,nop,TS val 828074861 ecr 828074861], length 0
14:26:21.672274 IP dhcp-10-250-101-2.harvard.edu.6002 > dhcp-10-250-101-2.harvard.edu.55170: Flags [P.], seq 50:67, ack 3006, win 6332, options [nop,nop,TS val 828074861 ecr 828074861], length 17
14:26:21.672325 IP dhcp-10-250-101-2.harvard.edu.55170 > dhcp-10-250-101-2.harvard.edu.6002: Flags [.], ack 67, win 6378, options [nop,nop,TS val 828074862 ecr 828074861], length 0
14:26:21.672547 IP dhcp-10-250-101-2.harvard.edu.55170 > dhcp-10-250-101-2.harvard.edu.6002: Flags [P.], seq 3006:3023, ack 67, win 6378, options [nop,nop,TS val 828074862 ecr 828074861], length 17
14:26:21.672595 IP dhcp-10-250-101-2.harvard.edu.6002 > dhcp-10-250-101-2.harvard.edu.55170: Flags [.], ack 3023, win 6332, options [nop,nop,TS val 828074862 ecr 828074862], length 0
14:26:21.678117 IP dhcp-10-250-101-2.harvard.edu.6002 > dhcp-10-250-101-2.harvard.edu.55170: Flags [P.], seq 67:184, ack 3023, win 6332, options [nop,nop,TS val 828074867 ecr 828074862], length 117
14:26:21.678159 IP dhcp-10-250-101-2.harvard.edu.55170 > dhcp-10-250-101-2.harvard.edu.6002: Flags [.], ack 184, win 6376, options [nop,nop,TS val 828074867 ecr 828074867], length 0
14:26:21.679467 IP dhcp-10-250-101-2.harvard.edu.55170 > dhcp-10-250-101-2.harvard.edu.6002: Flags [P.], seq 3023:3040, ack 184, win 6376, options [nop,nop,TS val 828074868 ecr 828074867], length 17
14:26:21.679514 IP dhcp-10-250-101-2.harvard.edu.6002 > dhcp-10-250-101-2.harvard.edu.55170: Flags [.], ack 3040, win 6332, options [nop,nop,TS val 828074868 ecr 828074868], length 0
14:26:21.679728 IP dhcp-10-250-101-2.harvard.edu.6002 > dhcp-10-250-101-2.harvard.edu.55170: Flags [P.], seq 184:201, ack 3040, win 6332, options [nop,nop,TS val 828074868 ecr 828074868], length 17
14:26:21.679760 IP dhcp-10-250-101-2.harvard.edu.55170 > dhcp-10-250-101-2.harvard.edu.6002: Flags [.], ack 201, win 6376, options [nop,nop,TS val 828074868 ecr 828074868], length 0
14:26:21.684109 IP dhcp-10-250-101-2.harvard.edu.55171 > dhcp-10-250-101-2.harvard.edu.6003: Flags [S], seq 4103266867, win 65535, options [mss 16344,nop,wscale 6,nop,nop,TS val 828074871 ecr 0,sackOK,eol], length 0
14:26:21.684250 IP dhcp-10-250-101-2.harvard.edu.6003 > dhcp-10-250-101-2.harvard.edu.55171: Flags [S.], seq 530955507, ack 4103266868, win 65535, options [mss 16344,nop,wscale 6,nop,nop,TS val 828074871 ecr 828074871,sackOK,eol], length 0
14:26:21.684258 IP dhcp-10-250-101-2.harvard.edu.55171 > dhcp-10-250-101-2.harvard.edu.6003: Flags [.], ack 1, win 6379, options [nop,nop,TS val 828074871 ecr 828074871], length 0
14:26:21.684265 IP dhcp-10-250-101-2.harvard.edu.6003 > dhcp-10-250-101-2.harvard.edu.55171: Flags [.], ack 1, win 6379, options [nop,nop,TS val 828074871 ecr 828074871], length 0
14:26:21.686018 IP dhcp-10-250-101-2.harvard.edu.55171 > dhcp-10-250-101-2.harvard.edu.6003: Flags [P.], seq 1:71, ack 1, win 6379, options [nop,nop,TS val 828074873 ecr 828074871], length 70
14:26:21.686048 IP dhcp-10-250-101-2.harvard.edu.6003 > dhcp-10-250-101-2.harvard.edu.55171: Flags [.], ack 71, win 6378, options [nop,nop,TS val 828074873 ecr 828074873], length 0
14:26:21.687086 IP dhcp-10-250-101-2.harvard.edu.6003 > dhcp-10-250-101-2.harvard.edu.55171: Flags [P.], seq 1:41, ack 71, win 6378, options [nop,nop,TS val 828074874 ecr 828074873], length 40
14:26:21.687114 IP dhcp-10-250-101-2.harvard.edu.55171 > dhcp-10-250-101-2.harvard.edu.6003: Flags [.], ack 41, win 6379, options [nop,nop,TS val 828074874 ecr 828074874], length 0
14:26:21.687946 IP dhcp-10-250-101-2.harvard.edu.6003 > dhcp-10-250-101-2.harvard.edu.55171: Flags [P.], seq 41:50, ack 71, win 6378, options [nop,nop,TS val 828074874 ecr 828074874], length 9
14:26:21.687965 IP dhcp-10-250-101-2.harvard.edu.55171 > dhcp-10-250-101-2.harvard.edu.6003: Flags [.], ack 50, win 6378, options [nop,nop,TS val 828074874 ecr 828074874], length 0
14:26:21.687997 IP dhcp-10-250-101-2.harvard.edu.55171 > dhcp-10-250-101-2.harvard.edu.6003: Flags [P.], seq 71:80, ack 50, win 6378, options [nop,nop,TS val 828074874 ecr 828074874], length 9
14:26:21.688015 IP dhcp-10-250-101-2.harvard.edu.6003 > dhcp-10-250-101-2.harvard.edu.55171: Flags [.], ack 80, win 6378, options [nop,nop,TS val 828074874 ecr 828074874], length 0
14:26:21.688519 IP dhcp-10-250-101-2.harvard.edu.55171 > dhcp-10-250-101-2.harvard.edu.6003: Flags [P.], seq 80:3754, ack 50, win 6378, options [nop,nop,TS val 828074875 ecr 828074874], length 3674
14:26:21.688537 IP dhcp-10-250-101-2.harvard.edu.6003 > dhcp-10-250-101-2.harvard.edu.55171: Flags [.], ack 3754, win 6321, options [nop,nop,TS val 828074875 ecr 828074875], length 0
14:26:21.689772 IP dhcp-10-250-101-2.harvard.edu.6003 > dhcp-10-250-101-2.harvard.edu.55171: Flags [P.], seq 50:67, ack 3754, win 6321, options [nop,nop,TS val 828074876 ecr 828074875], length 17
14:26:21.689789 IP dhcp-10-250-101-2.harvard.edu.55171 > dhcp-10-250-101-2.harvard.edu.6003: Flags [.], ack 67, win 6378, options [nop,nop,TS val 828074876 ecr 828074876], length 0
14:26:21.690026 IP dhcp-10-250-101-2.harvard.edu.55171 > dhcp-10-250-101-2.harvard.edu.6003: Flags [P.], seq 3754:3771, ack 67, win 6378, options [nop,nop,TS val 828074876 ecr 828074876], length 17
14:26:21.690043 IP dhcp-10-250-101-2.harvard.edu.6003 > dhcp-10-250-101-2.harvard.edu.55171: Flags [.], ack 3771, win 6320, options [nop,nop,TS val 828074876 ecr 828074876], length 0
14:26:21.696884 IP dhcp-10-250-101-2.harvard.edu.6003 > dhcp-10-250-101-2.harvard.edu.55171: Flags [P.], seq 67:184, ack 3771, win 6320, options [nop,nop,TS val 828074883 ecr 828074876], length 117
14:26:21.696936 IP dhcp-10-250-101-2.harvard.edu.55171 > dhcp-10-250-101-2.harvard.edu.6003: Flags [.], ack 184, win 6376, options [nop,nop,TS val 828074883 ecr 828074883], length 0
14:26:21.698298 IP dhcp-10-250-101-2.harvard.edu.55171 > dhcp-10-250-101-2.harvard.edu.6003: Flags [P.], seq 3771:3788, ack 184, win 6376, options [nop,nop,TS val 828074884 ecr 828074883], length 17
14:26:21.698329 IP dhcp-10-250-101-2.harvard.edu.6003 > dhcp-10-250-101-2.harvard.edu.55171: Flags [.], ack 3788, win 6320, options [nop,nop,TS val 828074884 ecr 828074884], length 0
14:26:21.698575 IP dhcp-10-250-101-2.harvard.edu.6003 > dhcp-10-250-101-2.harvard.edu.55171: Flags [P.], seq 184:201, ack 3788, win 6320, options [nop,nop,TS val 828074884 ecr 828074884], length 17
14:26:21.698601 IP dhcp-10-250-101-2.harvard.edu.55171 > dhcp-10-250-101-2.harvard.edu.6003: Flags [.], ack 201, win 6376, options [nop,nop,TS val 828074884 ecr 828074884], length 0
14:26:21.700481 IP dhcp-10-250-101-2.harvard.edu.55168 > dhcp-10-250-101-2.harvard.edu.6000: Flags [P.], seq 14653:14725, ack 201, win 6376, options [nop,nop,TS val 828074886 ecr 828074824], length 72
14:26:21.700517 IP dhcp-10-250-101-2.harvard.edu.6000 > dhcp-10-250-101-2.harvard.edu.55168: Flags [.], ack 14725, win 6149, options [nop,nop,TS val 828074886 ecr 828074886], length 0
14:26:21.701602 IP dhcp-10-250-101-2.harvard.edu.6000 > dhcp-10-250-101-2.harvard.edu.55168: Flags [P.], seq 201:218, ack 14725, win 6149, options [nop,nop,TS val 828074887 ecr 828074886], length 17
14:26:21.701626 IP dhcp-10-250-101-2.harvard.edu.55168 > dhcp-10-250-101-2.harvard.edu.6000: Flags [.], ack 218, win 6376, options [nop,nop,TS val 828074887 ecr 828074887], length 0
14:26:21.701793 IP dhcp-10-250-101-2.harvard.edu.55168 > dhcp-10-250-101-2.harvard.edu.6000: Flags [P.], seq 14725:14742, ack 218, win 6376, options [nop,nop,TS val 828074887 ecr 828074887], length 17
14:26:21.701803 IP dhcp-10-250-101-2.harvard.edu.6000 > dhcp-10-250-101-2.harvard.edu.55168: Flags [.], ack 14742, win 6149, options [nop,nop,TS val 828074887 ecr 828074887], length 0
14:26:21.703725 IP dhcp-10-250-101-2.harvard.edu.6000 > dhcp-10-250-101-2.harvard.edu.55168: Flags [P.], seq 218:255, ack 14742, win 6149, options [nop,nop,TS val 828074889 ecr 828074887], length 37
14:26:21.703772 IP dhcp-10-250-101-2.harvard.edu.55168 > dhcp-10-250-101-2.harvard.edu.6000: Flags [.], ack 255, win 6375, options [nop,nop,TS val 828074889 ecr 828074889], length 0
14:26:21.704583 IP dhcp-10-250-101-2.harvard.edu.55168 > dhcp-10-250-101-2.harvard.edu.6000: Flags [P.], seq 14742:14759, ack 255, win 6375, options [nop,nop,TS val 828074889 ecr 828074889], length 17
14:26:21.704619 IP dhcp-10-250-101-2.harvard.edu.6000 > dhcp-10-250-101-2.harvard.edu.55168: Flags [.], ack 14759, win 6149, options [nop,nop,TS val 828074889 ecr 828074889], length 0
14:26:21.705076 IP dhcp-10-250-101-2.harvard.edu.6000 > dhcp-10-250-101-2.harvard.edu.55168: Flags [P.], seq 255:272, ack 14759, win 6149, options [nop,nop,TS val 828074890 ecr 828074889], length 17
14:26:21.705110 IP dhcp-10-250-101-2.harvard.edu.55168 > dhcp-10-250-101-2.harvard.edu.6000: Flags [.], ack 272, win 6375, options [nop,nop,TS val 828074890 ecr 828074890], length 0
14:26:22.706196 IP dhcp-10-250-101-2.harvard.edu.55168 > dhcp-10-250-101-2.harvard.edu.6000: Flags [P.], seq 14759:14795, ack 272, win 6375, options [nop,nop,TS val 828075879 ecr 828074890], length 36
14:26:22.706270 IP dhcp-10-250-101-2.harvard.edu.6000 > dhcp-10-250-101-2.harvard.edu.55168: Flags [.], ack 14795, win 6148, options [nop,nop,TS val 828075879 ecr 828075879], length 0
14:26:22.708281 IP dhcp-10-250-101-2.harvard.edu.6000 > dhcp-10-250-101-2.harvard.edu.55168: Flags [P.], seq 272:289, ack 14795, win 6148, options [nop,nop,TS val 828075880 ecr 828075879], length 17
14:26:22.708333 IP dhcp-10-250-101-2.harvard.edu.55168 > dhcp-10-250-101-2.harvard.edu.6000: Flags [.], ack 289, win 6375, options [nop,nop,TS val 828075880 ecr 828075880], length 0
14:26:22.708586 IP dhcp-10-250-101-2.harvard.edu.55168 > dhcp-10-250-101-2.harvard.edu.6000: Flags [P.], seq 14795:14812, ack 289, win 6375, options [nop,nop,TS val 828075880 ecr 828075880], length 17
14:26:22.708639 IP dhcp-10-250-101-2.harvard.edu.6000 > dhcp-10-250-101-2.harvard.edu.55168: Flags [.], ack 14812, win 6148, options [nop,nop,TS val 828075880 ecr 828075880], length 0
14:26:22.709292 IP dhcp-10-250-101-2.harvard.edu.6000 > dhcp-10-250-101-2.harvard.edu.55168: Flags [P.], seq 289:326, ack 14812, win 6148, options [nop,nop,TS val 828075881 ecr 828075880], length 37
14:26:22.709351 IP dhcp-10-250-101-2.harvard.edu.55168 > dhcp-10-250-101-2.harvard.edu.6000: Flags [.], ack 326, win 6374, options [nop,nop,TS val 828075881 ecr 828075881], length 0
14:26:22.710352 IP dhcp-10-250-101-2.harvard.edu.55168 > dhcp-10-250-101-2.harvard.edu.6000: Flags [P.], seq 14812:14829, ack 326, win 6374, options [nop,nop,TS val 828075882 ecr 828075881], length 17
14:26:22.710378 IP dhcp-10-250-101-2.harvard.edu.6000 > dhcp-10-250-101-2.harvard.edu.55168: Flags [.], ack 14829, win 6148, options [nop,nop,TS val 828075882 ecr 828075882], length 0
14:26:22.710631 IP dhcp-10-250-101-2.harvard.edu.6000 > dhcp-10-250-101-2.harvard.edu.55168: Flags [P.], seq 326:343, ack 14829, win 6148, options [nop,nop,TS val 828075882 ecr 828075882], length 17
14:26:22.710680 IP dhcp-10-250-101-2.harvard.edu.55168 > dhcp-10-250-101-2.harvard.edu.6000: Flags [.], ack 343, win 6374, options [nop,nop,TS val 828075882 ecr 828075882], length 0
14:26:23.713180 IP dhcp-10-250-101-2.harvard.edu.55168 > dhcp-10-250-101-2.harvard.edu.6000: Flags [P.], seq 14829:14865, ack 343, win 6374, options [nop,nop,TS val 828076867 ecr 828075882], length 36
14:26:23.713235 IP dhcp-10-250-101-2.harvard.edu.6000 > dhcp-10-250-101-2.harvard.edu.55168: Flags [.], ack 14865, win 6147, options [nop,nop,TS val 828076867 ecr 828076867], length 0
14:26:23.714330 IP dhcp-10-250-101-2.harvard.edu.6000 > dhcp-10-250-101-2.harvard.edu.55168: Flags [P.], seq 343:360, ack 14865, win 6147, options [nop,nop,TS val 828076868 ecr 828076867], length 17
14:26:23.714379 IP dhcp-10-250-101-2.harvard.edu.55168 > dhcp-10-250-101-2.harvard.edu.6000: Flags [.], ack 360, win 6374, options [nop,nop,TS val 828076868 ecr 828076868], length 0
14:26:23.714645 IP dhcp-10-250-101-2.harvard.edu.55168 > dhcp-10-250-101-2.harvard.edu.6000: Flags [P.], seq 14865:14882, ack 360, win 6374, options [nop,nop,TS val 828076868 ecr 828076868], length 17
14:26:23.714673 IP dhcp-10-250-101-2.harvard.edu.6000 > dhcp-10-250-101-2.harvard.edu.55168: Flags [.], ack 14882, win 6147, options [nop,nop,TS val 828076868 ecr 828076868], length 0
14:26:23.715109 IP dhcp-10-250-101-2.harvard.edu.6000 > dhcp-10-250-101-2.harvard.edu.55168: Flags [P.], seq 360:397, ack 14882, win 6147, options [nop,nop,TS val 828076868 ecr 828076868], length 37
14:26:23.715154 IP dhcp-10-250-101-2.harvard.edu.55168 > dhcp-10-250-101-2.harvard.edu.6000: Flags [.], ack 397, win 6373, options [nop,nop,TS val 828076868 ecr 828076868], length 0
14:26:23.716017 IP dhcp-10-250-101-2.harvard.edu.55168 > dhcp-10-250-101-2.harvard.edu.6000: Flags [P.], seq 14882:14899, ack 397, win 6373, options [nop,nop,TS val 828076869 ecr 828076868], length 17
14:26:23.716073 IP dhcp-10-250-101-2.harvard.edu.6000 > dhcp-10-250-101-2.harvard.edu.55168: Flags [.], ack 14899, win 6146, options [nop,nop,TS val 828076869 ecr 828076869], length 0
14:26:23.716292 IP dhcp-10-250-101-2.harvard.edu.6000 > dhcp-10-250-101-2.harvard.edu.55168: Flags [P.], seq 397:414, ack 14899, win 6146, options [nop,nop,TS val 828076869 ecr 828076869], length 17
14:26:23.716312 IP dhcp-10-250-101-2.harvard.edu.55168 > dhcp-10-250-101-2.harvard.edu.6000: Flags [.], ack 414, win 6373, options [nop,nop,TS val 828076869 ecr 828076869], length 0
14:26:24.722071 IP dhcp-10-250-101-2.harvard.edu.55168 > dhcp-10-250-101-2.harvard.edu.6000: Flags [P.], seq 14899:14935, ack 414, win 6373, options [nop,nop,TS val 828077868 ecr 828076869], length 36
14:26:24.722106 IP dhcp-10-250-101-2.harvard.edu.6000 > dhcp-10-250-101-2.harvard.edu.55168: Flags [.], ack 14935, win 6146, options [nop,nop,TS val 828077868 ecr 828077868], length 0
14:26:24.723649 IP dhcp-10-250-101-2.harvard.edu.6000 > dhcp-10-250-101-2.harvard.edu.55168: Flags [P.], seq 414:431, ack 14935, win 6146, options [nop,nop,TS val 828077869 ecr 828077868], length 17
14:26:24.723708 IP dhcp-10-250-101-2.harvard.edu.55168 > dhcp-10-250-101-2.harvard.edu.6000: Flags [.], ack 431, win 6372, options [nop,nop,TS val 828077869 ecr 828077869], length 0
14:26:24.724063 IP dhcp-10-250-101-2.harvard.edu.55168 > dhcp-10-250-101-2.harvard.edu.6000: Flags [P.], seq 14935:14952, ack 431, win 6372, options [nop,nop,TS val 828077869 ecr 828077869], length 17
14:26:24.724093 IP dhcp-10-250-101-2.harvard.edu.6000 > dhcp-10-250-101-2.harvard.edu.55168: Flags [.], ack 14952, win 6146, options [nop,nop,TS val 828077869 ecr 828077869], length 0
14:26:24.724801 IP dhcp-10-250-101-2.harvard.edu.6000 > dhcp-10-250-101-2.harvard.edu.55168: Flags [P.], seq 431:468, ack 14952, win 6146, options [nop,nop,TS val 828077870 ecr 828077869], length 37
14:26:24.724851 IP dhcp-10-250-101-2.harvard.edu.55168 > dhcp-10-250-101-2.harvard.edu.6000: Flags [.], ack 468, win 6372, options [nop,nop,TS val 828077870 ecr 828077870], length 0
14:26:24.725995 IP dhcp-10-250-101-2.harvard.edu.55168 > dhcp-10-250-101-2.harvard.edu.6000: Flags [P.], seq 14952:14969, ack 468, win 6372, options [nop,nop,TS val 828077871 ecr 828077870], length 17
14:26:24.726054 IP dhcp-10-250-101-2.harvard.edu.6000 > dhcp-10-250-101-2.harvard.edu.55168: Flags [.], ack 14969, win 6145, options [nop,nop,TS val 828077871 ecr 828077871], length 0
14:26:24.726328 IP dhcp-10-250-101-2.harvard.edu.6000 > dhcp-10-250-101-2.harvard.edu.55168: Flags [P.], seq 468:485, ack 14969, win 6145, options [nop,nop,TS val 828077871 ecr 828077871], length 17
14:26:24.726362 IP dhcp-10-250-101-2.harvard.edu.55168 > dhcp-10-250-101-2.harvard.edu.6000: Flags [.], ack 485, win 6372, options [nop,nop,TS val 828077871 ecr 828077871], length 0
14:26:25.730489 IP dhcp-10-250-101-2.harvard.edu.55168 > dhcp-10-250-101-2.harvard.edu.6000: Flags [P.], seq 14969:15005, ack 485, win 6372, options [nop,nop,TS val 828078867 ecr 828077871], length 36
14:26:25.730559 IP dhcp-10-250-101-2.harvard.edu.6000 > dhcp-10-250-101-2.harvard.edu.55168: Flags [.], ack 15005, win 6145, options [nop,nop,TS val 828078867 ecr 828078867], length 0
14:26:25.732091 IP dhcp-10-250-101-2.harvard.edu.6000 > dhcp-10-250-101-2.harvard.edu.55168: Flags [P.], seq 485:502, ack 15005, win 6145, options [nop,nop,TS val 828078868 ecr 828078867], length 17
14:26:25.732147 IP dhcp-10-250-101-2.harvard.edu.55168 > dhcp-10-250-101-2.harvard.edu.6000: Flags [.], ack 502, win 6371, options [nop,nop,TS val 828078868 ecr 828078868], length 0
14:26:25.732439 IP dhcp-10-250-101-2.harvard.edu.55168 > dhcp-10-250-101-2.harvard.edu.6000: Flags [P.], seq 15005:15022, ack 502, win 6371, options [nop,nop,TS val 828078868 ecr 828078868], length 17
14:26:25.732475 IP dhcp-10-250-101-2.harvard.edu.6000 > dhcp-10-250-101-2.harvard.edu.55168: Flags [.], ack 15022, win 6144, options [nop,nop,TS val 828078868 ecr 828078868], length 0
14:26:25.733311 IP dhcp-10-250-101-2.harvard.edu.6000 > dhcp-10-250-101-2.harvard.edu.55168: Flags [P.], seq 502:539, ack 15022, win 6144, options [nop,nop,TS val 828078869 ecr 828078868], length 37
14:26:25.733362 IP dhcp-10-250-101-2.harvard.edu.55168 > dhcp-10-250-101-2.harvard.edu.6000: Flags [.], ack 539, win 6371, options [nop,nop,TS val 828078869 ecr 828078869], length 0
14:26:25.734364 IP dhcp-10-250-101-2.harvard.edu.55168 > dhcp-10-250-101-2.harvard.edu.6000: Flags [P.], seq 15022:15039, ack 539, win 6371, options [nop,nop,TS val 828078870 ecr 828078869], length 17
14:26:25.734415 IP dhcp-10-250-101-2.harvard.edu.6000 > dhcp-10-250-101-2.harvard.edu.55168: Flags [.], ack 15039, win 6144, options [nop,nop,TS val 828078870 ecr 828078870], length 0
14:26:25.734627 IP dhcp-10-250-101-2.harvard.edu.6000 > dhcp-10-250-101-2.harvard.edu.55168: Flags [P.], seq 539:556, ack 15039, win 6144, options [nop,nop,TS val 828078870 ecr 828078870], length 17
14:26:25.734648 IP dhcp-10-250-101-2.harvard.edu.55168 > dhcp-10-250-101-2.harvard.edu.6000: Flags [.], ack 556, win 6371, options [nop,nop,TS val 828078870 ecr 828078870], length 0
14:26:26.735610 IP dhcp-10-250-101-2.harvard.edu.55168 > dhcp-10-250-101-2.harvard.edu.6000: Flags [P.], seq 15039:15075, ack 556, win 6371, options [nop,nop,TS val 828079862 ecr 828078870], length 36
14:26:26.735642 IP dhcp-10-250-101-2.harvard.edu.6000 > dhcp-10-250-101-2.harvard.edu.55168: Flags [.], ack 15075, win 6144, options [nop,nop,TS val 828079862 ecr 828079862], length 0
14:26:26.737457 IP dhcp-10-250-101-2.harvard.edu.6000 > dhcp-10-250-101-2.harvard.edu.55168: Flags [P.], seq 556:573, ack 15075, win 6144, options [nop,nop,TS val 828079863 ecr 828079862], length 17
14:26:26.737491 IP dhcp-10-250-101-2.harvard.edu.55168 > dhcp-10-250-101-2.harvard.edu.6000: Flags [.], ack 573, win 6370, options [nop,nop,TS val 828079863 ecr 828079863], length 0
14:26:26.738007 IP dhcp-10-250-101-2.harvard.edu.55168 > dhcp-10-250-101-2.harvard.edu.6000: Flags [P.], seq 15075:15092, ack 573, win 6370, options [nop,nop,TS val 828079863 ecr 828079863], length 17
14:26:26.738045 IP dhcp-10-250-101-2.harvard.edu.6000 > dhcp-10-250-101-2.harvard.edu.55168: Flags [.], ack 15092, win 6143, options [nop,nop,TS val 828079863 ecr 828079863], length 0
14:26:26.740146 IP dhcp-10-250-101-2.harvard.edu.6000 > dhcp-10-250-101-2.harvard.edu.55168: Flags [P.], seq 573:610, ack 15092, win 6143, options [nop,nop,TS val 828079865 ecr 828079863], length 37
14:26:26.740212 IP dhcp-10-250-101-2.harvard.edu.55168 > dhcp-10-250-101-2.harvard.edu.6000: Flags [.], ack 610, win 6370, options [nop,nop,TS val 828079865 ecr 828079865], length 0
14:26:26.740275 IP dhcp-10-250-101-2.harvard.edu.55173 > dhcp-10-250-101-2.harvard.edu.6000: Flags [S], seq 1023625260, win 65535, options [mss 16344,nop,wscale 6,nop,nop,TS val 828079865 ecr 0,sackOK,eol], length 0
14:26:26.740331 IP dhcp-10-250-101-2.harvard.edu.55174 > dhcp-10-250-101-2.harvard.edu.6000: Flags [S], seq 1281964759, win 65535, options [mss 16344,nop,wscale 6,nop,nop,TS val 828079865 ecr 0,sackOK,eol], length 0
14:26:26.740508 IP dhcp-10-250-101-2.harvard.edu.6000 > dhcp-10-250-101-2.harvard.edu.55173: Flags [S.], seq 1300801187, ack 1023625261, win 65535, options [mss 16344,nop,wscale 6,nop,nop,TS val 828079865 ecr 828079865,sackOK,eol], length 0
14:26:26.740592 IP dhcp-10-250-101-2.harvard.edu.6000 > dhcp-10-250-101-2.harvard.edu.55174: Flags [S.], seq 3223953120, ack 1281964760, win 65535, options [mss 16344,nop,wscale 6,nop,nop,TS val 828079865 ecr 828079865,sackOK,eol], length 0
14:26:26.740600 IP dhcp-10-250-101-2.harvard.edu.55173 > dhcp-10-250-101-2.harvard.edu.6000: Flags [.], ack 1, win 6379, options [nop,nop,TS val 828079865 ecr 828079865], length 0
14:26:26.740605 IP dhcp-10-250-101-2.harvard.edu.55174 > dhcp-10-250-101-2.harvard.edu.6000: Flags [.], ack 1, win 6379, options [nop,nop,TS val 828079865 ecr 828079865], length 0
14:26:26.740615 IP dhcp-10-250-101-2.harvard.edu.6000 > dhcp-10-250-101-2.harvard.edu.55173: Flags [.], ack 1, win 6379, options [nop,nop,TS val 828079865 ecr 828079865], length 0
14:26:26.740619 IP dhcp-10-250-101-2.harvard.edu.6000 > dhcp-10-250-101-2.harvard.edu.55174: Flags [.], ack 1, win 6379, options [nop,nop,TS val 828079865 ecr 828079865], length 0
14:26:26.741154 IP dhcp-10-250-101-2.harvard.edu.55175 > dhcp-10-250-101-2.harvard.edu.6001: Flags [S], seq 1715989576, win 65535, options [mss 16344,nop,wscale 6,nop,nop,TS val 828079865 ecr 0,sackOK,eol], length 0
14:26:26.741305 IP dhcp-10-250-101-2.harvard.edu.6001 > dhcp-10-250-101-2.harvard.edu.55175: Flags [S.], seq 1810215375, ack 1715989577, win 65535, options [mss 16344,nop,wscale 6,nop,nop,TS val 828079866 ecr 828079865,sackOK,eol], length 0
14:26:26.741317 IP dhcp-10-250-101-2.harvard.edu.55175 > dhcp-10-250-101-2.harvard.edu.6001: Flags [.], ack 1, win 6379, options [nop,nop,TS val 828079866 ecr 828079866], length 0
14:26:26.741326 IP dhcp-10-250-101-2.harvard.edu.6001 > dhcp-10-250-101-2.harvard.edu.55175: Flags [.], ack 1, win 6379, options [nop,nop,TS val 828079866 ecr 828079866], length 0
14:26:26.742472 IP dhcp-10-250-101-2.harvard.edu.55173 > dhcp-10-250-101-2.harvard.edu.6000: Flags [P.], seq 1:71, ack 1, win 6379, options [nop,nop,TS val 828079867 ecr 828079865], length 70
14:26:26.742504 IP dhcp-10-250-101-2.harvard.edu.6000 > dhcp-10-250-101-2.harvard.edu.55173: Flags [.], ack 71, win 6378, options [nop,nop,TS val 828079867 ecr 828079867], length 0
14:26:26.743029 IP dhcp-10-250-101-2.harvard.edu.55174 > dhcp-10-250-101-2.harvard.edu.6000: Flags [P.], seq 1:71, ack 1, win 6379, options [nop,nop,TS val 828079867 ecr 828079865], length 70
14:26:26.743037 IP dhcp-10-250-101-2.harvard.edu.55175 > dhcp-10-250-101-2.harvard.edu.6001: Flags [P.], seq 1:71, ack 1, win 6379, options [nop,nop,TS val 828079867 ecr 828079866], length 70
14:26:26.743056 IP dhcp-10-250-101-2.harvard.edu.6000 > dhcp-10-250-101-2.harvard.edu.55174: Flags [.], ack 71, win 6378, options [nop,nop,TS val 828079867 ecr 828079867], length 0
14:26:26.743068 IP dhcp-10-250-101-2.harvard.edu.6001 > dhcp-10-250-101-2.harvard.edu.55175: Flags [.], ack 71, win 6378, options [nop,nop,TS val 828079867 ecr 828079867], length 0
14:26:26.744332 IP dhcp-10-250-101-2.harvard.edu.55168 > dhcp-10-250-101-2.harvard.edu.6000: Flags [P.], seq 15092:15109, ack 610, win 6370, options [nop,nop,TS val 828079868 ecr 828079865], length 17
14:26:26.744356 IP dhcp-10-250-101-2.harvard.edu.6000 > dhcp-10-250-101-2.harvard.edu.55168: Flags [.], ack 15109, win 6143, options [nop,nop,TS val 828079868 ecr 828079868], length 0
14:26:26.744399 IP dhcp-10-250-101-2.harvard.edu.6000 > dhcp-10-250-101-2.harvard.edu.55174: Flags [P.], seq 1:41, ack 71, win 6378, options [nop,nop,TS val 828079868 ecr 828079867], length 40
14:26:26.744418 IP dhcp-10-250-101-2.harvard.edu.55174 > dhcp-10-250-101-2.harvard.edu.6000: Flags [.], ack 41, win 6379, options [nop,nop,TS val 828079868 ecr 828079868], length 0
14:26:26.744927 IP dhcp-10-250-101-2.harvard.edu.6000 > dhcp-10-250-101-2.harvard.edu.55168: Flags [P.], seq 610:627, ack 15109, win 6143, options [nop,nop,TS val 828079868 ecr 828079868], length 17
14:26:26.744946 IP dhcp-10-250-101-2.harvard.edu.6001 > dhcp-10-250-101-2.harvard.edu.55175: Flags [P.], seq 1:41, ack 71, win 6378, options [nop,nop,TS val 828079868 ecr 828079867], length 40
14:26:26.744954 IP dhcp-10-250-101-2.harvard.edu.55168 > dhcp-10-250-101-2.harvard.edu.6000: Flags [.], ack 627, win 6369, options [nop,nop,TS val 828079868 ecr 828079868], length 0
14:26:26.744970 IP dhcp-10-250-101-2.harvard.edu.55175 > dhcp-10-250-101-2.harvard.edu.6001: Flags [.], ack 41, win 6379, options [nop,nop,TS val 828079868 ecr 828079868], length 0
14:26:26.745001 IP dhcp-10-250-101-2.harvard.edu.6000 > dhcp-10-250-101-2.harvard.edu.55173: Flags [P.], seq 1:41, ack 71, win 6378, options [nop,nop,TS val 828079868 ecr 828079867], length 40
14:26:26.745021 IP dhcp-10-250-101-2.harvard.edu.55173 > dhcp-10-250-101-2.harvard.edu.6000: Flags [.], ack 41, win 6379, options [nop,nop,TS val 828079868 ecr 828079868], length 0
14:26:26.745844 IP dhcp-10-250-101-2.harvard.edu.6000 > dhcp-10-250-101-2.harvard.edu.55174: Flags [P.], seq 41:50, ack 71, win 6378, options [nop,nop,TS val 828079869 ecr 828079868], length 9
14:26:26.745871 IP dhcp-10-250-101-2.harvard.edu.55174 > dhcp-10-250-101-2.harvard.edu.6000: Flags [.], ack 50, win 6378, options [nop,nop,TS val 828079869 ecr 828079869], length 0
14:26:26.745927 IP dhcp-10-250-101-2.harvard.edu.55174 > dhcp-10-250-101-2.harvard.edu.6000: Flags [P.], seq 71:80, ack 50, win 6378, options [nop,nop,TS val 828079869 ecr 828079869], length 9
14:26:26.745951 IP dhcp-10-250-101-2.harvard.edu.6000 > dhcp-10-250-101-2.harvard.edu.55174: Flags [.], ack 80, win 6378, options [nop,nop,TS val 828079869 ecr 828079869], length 0
14:26:26.746462 IP dhcp-10-250-101-2.harvard.edu.6000 > dhcp-10-250-101-2.harvard.edu.55173: Flags [P.], seq 41:50, ack 71, win 6378, options [nop,nop,TS val 828079869 ecr 828079868], length 9
14:26:26.746486 IP dhcp-10-250-101-2.harvard.edu.55173 > dhcp-10-250-101-2.harvard.edu.6000: Flags [.], ack 50, win 6378, options [nop,nop,TS val 828079870 ecr 828079869], length 0
14:26:26.746493 IP dhcp-10-250-101-2.harvard.edu.6001 > dhcp-10-250-101-2.harvard.edu.55175: Flags [P.], seq 41:50, ack 71, win 6378, options [nop,nop,TS val 828079870 ecr 828079868], length 9
14:26:26.746502 IP dhcp-10-250-101-2.harvard.edu.55175 > dhcp-10-250-101-2.harvard.edu.6001: Flags [.], ack 50, win 6378, options [nop,nop,TS val 828079870 ecr 828079870], length 0
14:26:26.746560 IP dhcp-10-250-101-2.harvard.edu.55175 > dhcp-10-250-101-2.harvard.edu.6001: Flags [P.], seq 71:80, ack 50, win 6378, options [nop,nop,TS val 828079870 ecr 828079870], length 9
14:26:26.746599 IP dhcp-10-250-101-2.harvard.edu.6001 > dhcp-10-250-101-2.harvard.edu.55175: Flags [.], ack 80, win 6378, options [nop,nop,TS val 828079870 ecr 828079870], length 0
14:26:26.746625 IP dhcp-10-250-101-2.harvard.edu.55173 > dhcp-10-250-101-2.harvard.edu.6000: Flags [P.], seq 71:80, ack 50, win 6378, options [nop,nop,TS val 828079870 ecr 828079869], length 9
14:26:26.746648 IP dhcp-10-250-101-2.harvard.edu.6000 > dhcp-10-250-101-2.harvard.edu.55173: Flags [.], ack 80, win 6378, options [nop,nop,TS val 828079870 ecr 828079870], length 0
14:26:26.747166 IP dhcp-10-250-101-2.harvard.edu.55174 > dhcp-10-250-101-2.harvard.edu.6000: Flags [P.], seq 80:251, ack 50, win 6378, options [nop,nop,TS val 828079870 ecr 828079869], length 171
14:26:26.747184 IP dhcp-10-250-101-2.harvard.edu.6000 > dhcp-10-250-101-2.harvard.edu.55174: Flags [.], ack 251, win 6375, options [nop,nop,TS val 828079870 ecr 828079870], length 0
